{
  "schema_version": "1.0",
  "description": "Point-in-time NAV, share price, and 1-day change extracted from Groww pages. Refreshed on each scheduled ingestion run.",
  "as_of_date": "2026-06-08",
  "currency": "INR",
  "products": [
    {
      "id": 1,
      "scheme_name": "HDFC Silver ETF FoF Direct Growth",
      "product_type": "mutual_fund",
      "source_url": "https://groww.in/mutual-funds/hdfc-silver-etf-fof-direct-growth",
      "local_file": "hdfc-silver-etf-fof-direct-growth.md",
      "nav": 39.31,
      "nav_date": "2026-06-08",
      "change_1d_pct": -6.55,
      "aum_cr": 4433.98,
      "expense_ratio_pct": 0.21
    },
    {
      "id": 2,
      "scheme_name": "HDFC Mid Cap Fund Direct Growth",
      "product_type": "mutual_fund",
      "source_url": "https://groww.in/mutual-funds/hdfc-mid-cap-fund-direct-growth",
      "local_file": "hdfc-mid-cap-fund-direct-growth-2.md",
      "nav": 218.0,
      "nav_date": "2026-06-08",
      "change_1d_pct": -1.06,
      "aum_cr": 94744.72,
      "expense_ratio_pct": 0.73
    },
    {
      "id": 3,
      "scheme_name": "HDFC Flexi Cap Direct Plan Growth",
      "product_type": "mutual_fund",
      "source_url": "https://groww.in/mutual-funds/hdfc-equity-fund-direct-growth",
      "local_file": "hdfc-equity-fund-direct-growth-3.md",
      "nav": 2103.13,
      "nav_date": "2026-06-08",
      "change_1d_pct": -0.78,
      "aum_cr": 100479.23,
      "expense_ratio_pct": 0.68
    },
    {
      "id": 4,
      "scheme_name": "HDFC Defence Fund Direct Growth",
      "product_type": "mutual_fund",
      "source_url": "https://groww.in/mutual-funds/hdfc-defence-fund-direct-growth",
      "local_file": "hdfc-defence-fund-direct-growth.md",
      "nav": 28.4,
      "nav_date": "2026-06-08",
      "change_1d_pct": -1.11,
      "aum_cr": 9123.61,
      "expense_ratio_pct": 0.83
    },
    {
      "id": 5,
      "scheme_name": "HDFC Small Cap Fund Direct Growth",
      "product_type": "mutual_fund",
      "source_url": "https://groww.in/mutual-funds/hdfc-small-cap-fund-direct-growth",
      "local_file": "hdfc-small-cap-fund-direct-growth-7.md",
      "nav": 150.7,
      "nav_date": "2026-06-08",
      "change_1d_pct": -1.29,
      "aum_cr": 38168.18,
      "expense_ratio_pct": 0.73
    },
    {
      "id": 6,
      "scheme_name": "HDFC Gold ETF Fund of Fund Direct Plan Growth",
      "product_type": "mutual_fund",
      "source_url": "https://groww.in/mutual-funds/hdfc-gold-etf-fund-of-fund-direct-plan-growth",
      "local_file": "hdfc-gold-etf-fund-of-fund-direct-plan-growth.md",
      "nav": 46.89,
      "nav_date": "2026-06-08",
      "change_1d_pct": -2.72,
      "aum_cr": 11464.35,
      "expense_ratio_pct": 0.2
    },
    {
      "id": 7,
      "scheme_name": "HDFC Balanced Advantage Fund Direct Growth",
      "product_type": "mutual_fund",
      "source_url": "https://groww.in/mutual-funds/hdfc-balanced-advantage-fund-direct-growth",
      "local_file": "hdfc-balanced-advantage-fund-direct-growth-11.md",
      "nav": 546.1,
      "nav_date": "2026-06-08",
      "change_1d_pct": -0.75,
      "aum_cr": 105377.65,
      "expense_ratio_pct": 0.75
    },
    {
      "id": 8,
      "scheme_name": "HDFC Silver ETF",
      "product_type": "etf",
      "source_url": "https://groww.in/etfs/hdfc-silver-etf",
      "local_file": "hdfc-silver-etf-6.md",
      "current_price": 232.36,
      "change_1d_abs": 4.78,
      "change_1d_pct": 2.1,
      "previous_close": 227.58,
      "market_cap_cr": 7649.0,
      "expense_ratio_pct": 0.5
    },
    {
      "id": 9,
      "scheme_name": "HDFC NIFTY Smallcap 250 ETF",
      "product_type": "etf",
      "source_url": "https://groww.in/etfs/hdfc-nifty-smallcap-etf",
      "local_file": "hdfc-nifty-smallcap-etf-9.md",
      "current_price": 169.76,
      "change_1d_abs": 1.19,
      "change_1d_pct": 0.71,
      "previous_close": 168.57,
      "market_cap_cr": 2555.0,
      "expense_ratio_pct": 0.25
    },
    {
      "id": 10,
      "scheme_name": "HDFC Gold ETF",
      "product_type": "etf",
      "source_url": "https://groww.in/etfs/hdfc-mutual-fundhdfc-gold-exchange-traded-fund",
      "local_file": "hdfc-mutual-fundhdfc-gold-exchange-traded-fund-10.md",
      "current_price": 129.78,
      "change_1d_abs": 1.36,
      "change_1d_pct": 1.06,
      "market_cap_cr": 23239.0,
      "previous_close": 128.42,
      "expense_ratio_pct": 0.59
    },
    {
      "id": 11,
      "scheme_name": "HDFC Bank Ltd",
      "product_type": "stock",
      "source_url": "https://groww.in/stocks/hdfc-bank-ltd",
      "local_file": "hdfc-bank-ltd-1.md",
      "current_price": 735.75,
      "change_1d_abs": -2.9,
      "change_1d_pct": -0.39,
      "market_cap_cr": 1137193.0,
      "previous_close": 738.65
    },
    {
      "id": 12,
      "scheme_name": "HDFC Life Insurance Company Ltd",
      "product_type": "stock",
      "source_url": "https://groww.in/stocks/hdfc-standard-life-insurance-co-ltd",
      "local_file": "hdfc-standard-life-insurance-co-ltd-5.md",
      "current_price": 562.45,
      "change_1d_abs": -2.1,
      "change_1d_pct": -0.37,
      "market_cap_cr": 121676.0,
      "previous_close": 564.55
    }
  ]
}
